{
  "user_email": "john.doe4@gmail.com",
  "username": "johndoe5",
  "user_information": {
  },
  "email_verified": false,
  "user_id": "auth0|571e653acda2f77e02ef6b80",
  "avatar": "https://s.gravatar.com/avatar/cd541925222efc34dbc51a715013ed5e?s=480&r=pg&d=https%3A%2F%2Fcdn.auth0.com%2Favatars%2Fjo.png",
  "nickname": null,
  "identities": [
    {
      "connection": "MotherShip",
      "user_id": "571e653acda2f77e02ef6b80",
      "provider": "auth0",
      "isSocial": false
    }
  ],
  "updated_at": "2016-04-25T18:43:06.448Z",
  "created_at": "2016-04-25T18:43:06.448Z",
  "application_information": {}
}